{
  "axisConvention": "x-east-y-up-z-negative-north",
  "buildingCount": 1,
  "buildingIds": [
    "fixture-west-boundary"
  ],
  "colliders": [
    {
      "boundsLocal": {
        "maxEast": 275.059558,
        "maxNegativeNorth": 10.039936,
        "maxY": 37.7,
        "minEast": 234.983525,
        "minNegativeNorth": -32.143627,
        "minY": -0.3
      },
      "buildingId": "fixture-west-boundary",
      "footprintLocal": [
        [
          234.983525,
          10.038546
        ],
        [
          275.058209,
          10.039936
        ],
        [
          275.059558,
          -32.142237
        ],
        [
          234.985102,
          -32.143627
        ]
      ],
      "maxY": 37.7,
      "minY": -0.3
    }
  ],
  "coordinateSpace": "tile-local-horizontal-plus-hq-local-y-up-meters",
  "footprintLocalAxisOrder": [
    "tile-local-east",
    "tile-local-negative-north"
  ],
  "normalizedDerivationSha256": "831e33be20dbe3dbd8c55d1fa54bfc2191eb881f68897ebf5a5e8ff7d81e7329",
  "schemaVersion": 2,
  "sourceHash": "3e84d67fff2729f1a742bca2c4223907d6ca256859668dde28b66c76e892c73a",
  "sourceId": "phase1-synthetic-buildings",
  "tileId": "256_m002_p000",
  "tileOriginAxisOrder": [
    "hq-local-east",
    "hq-local-north"
  ],
  "tileOriginMeters": [
    -512,
    0
  ],
  "tileSizeMeters": 256,
  "verticalAxis": "hq-local-y-up"
}
