{
  "axisConvention": "x-east-y-up-z-negative-north",
  "buildingCount": 1,
  "buildingIds": [
    "fixture-southwest-lowrise"
  ],
  "colliders": [
    {
      "boundsLocal": {
        "maxEast": 161.703528,
        "maxNegativeNorth": -156.699385,
        "maxY": 18.3,
        "minEast": 106.594266,
        "minNegativeNorth": -228.020402,
        "minY": -1.2
      },
      "buildingId": "fixture-southwest-lowrise",
      "footprintLocal": [
        [
          106.594266,
          -156.702195
        ],
        [
          161.700157,
          -156.699385
        ],
        [
          161.703528,
          -228.017592
        ],
        [
          106.598168,
          -228.020402
        ]
      ],
      "maxY": 18.3,
      "minY": -1.2
    }
  ],
  "coordinateSpace": "tile-local-horizontal-plus-hq-local-y-up-meters",
  "footprintLocalAxisOrder": [
    "tile-local-east",
    "tile-local-negative-north"
  ],
  "normalizedDerivationSha256": "d4b50ebf47b9b3e8f59138dbc58401404e91e584da1abdd3b1dd3f59d4d96422",
  "schemaVersion": 2,
  "sourceHash": "5ffab7c95bb6a12715636febb4ff62a2d8add52cd35d6907e3da82bfc1dc347a",
  "sourceId": "phase1-synthetic-buildings",
  "tileId": "256_m002_m002",
  "tileOriginAxisOrder": [
    "hq-local-east",
    "hq-local-north"
  ],
  "tileOriginMeters": [
    -512,
    -512
  ],
  "tileSizeMeters": 256,
  "verticalAxis": "hq-local-y-up"
}
