{
  "axisConvention": "x-east-y-up-z-negative-north",
  "buildingCount": 1,
  "buildingIds": [
    "fixture-northeast-landmark"
  ],
  "colliders": [
    {
      "boundsLocal": {
        "maxEast": 178.227811,
        "maxNegativeNorth": -120.714124,
        "maxY": 211.1,
        "minEast": 127.13904,
        "minNegativeNorth": -178.971352,
        "minY": 1.1
      },
      "buildingId": "fixture-northeast-landmark",
      "footprintLocal": [
        [
          127.142053,
          -120.714124
        ],
        [
          178.227811,
          -120.716942
        ],
        [
          178.224396,
          -178.971352
        ],
        [
          127.13904,
          -178.968534
        ]
      ],
      "maxY": 211.1,
      "minY": 1.1
    }
  ],
  "coordinateSpace": "tile-local-horizontal-plus-hq-local-y-up-meters",
  "footprintLocalAxisOrder": [
    "tile-local-east",
    "tile-local-negative-north"
  ],
  "normalizedDerivationSha256": "d4b50ebf47b9b3e8f59138dbc58401404e91e584da1abdd3b1dd3f59d4d96422",
  "schemaVersion": 2,
  "sourceHash": "5ffab7c95bb6a12715636febb4ff62a2d8add52cd35d6907e3da82bfc1dc347a",
  "sourceId": "phase1-synthetic-buildings",
  "tileId": "256_p001_p001",
  "tileOriginAxisOrder": [
    "hq-local-east",
    "hq-local-north"
  ],
  "tileOriginMeters": [
    256,
    256
  ],
  "tileSizeMeters": 256,
  "verticalAxis": "hq-local-y-up"
}
