{
  "axisConvention": "x-east-y-up-z-negative-north",
  "buildingCount": 1,
  "buildingIds": [
    "fixture-concave"
  ],
  "colliders": [
    {
      "boundsLocal": {
        "maxEast": 192.849635,
        "maxNegativeNorth": -160.591129,
        "maxY": 27.0,
        "minEast": 112.698733,
        "minNegativeNorth": -240.943788,
        "minY": 0.0
      },
      "buildingId": "fixture-concave",
      "footprintLocal": [
        [
          112.699344,
          -160.591129
        ],
        [
          192.849635,
          -160.592781
        ],
        [
          192.847544,
          -240.943788
        ],
        [
          152.772833,
          -240.942853
        ],
        [
          152.773661,
          -200.767349
        ],
        [
          112.698733,
          -200.766631
        ]
      ],
      "maxY": 27.0,
      "minY": 0.0
    }
  ],
  "coordinateSpace": "tile-local-horizontal-plus-hq-local-y-up-meters",
  "footprintLocalAxisOrder": [
    "tile-local-east",
    "tile-local-negative-north"
  ],
  "normalizedDerivationSha256": "d4b50ebf47b9b3e8f59138dbc58401404e91e584da1abdd3b1dd3f59d4d96422",
  "schemaVersion": 2,
  "sourceHash": "5ffab7c95bb6a12715636febb4ff62a2d8add52cd35d6907e3da82bfc1dc347a",
  "sourceId": "phase1-synthetic-buildings",
  "tileId": "256_p000_m001",
  "tileOriginAxisOrder": [
    "hq-local-east",
    "hq-local-north"
  ],
  "tileOriginMeters": [
    0,
    -256
  ],
  "tileSizeMeters": 256,
  "verticalAxis": "hq-local-y-up"
}
